{
  "schemaVersion": "2.0",
  "kind": "feedback-parse-result",
  "sampleId": "synthetic-linear-equation",
  "subjectPack": "math-answer",
  "parseMode": "teacher_text_lexicon",
  "sourceRunSha256": "d19f8766895cdeaa13408756156edba723c6dd4b28aaaa27dbe9dc0c4a62a1b9",
  "sampleIndexSha256": "0c8a6b48c6abe8e1a010a6813451fe79ebdad76f1f016668627bd7a74677b3c7",
  "samplePackageSha256": "04c8c1fdfeec27ef4bf8b712e90e8ee557f71cb51f4b4b43cecff81f667907e1",
  "candidateDescriptorSha256": "9b3e0feda8e077373a3323ed60d794b566b45fbf5ace62525b8291eb0b6acf66",
  "sourceFeedbackId": "synthetic-teacher-format-low",
  "sourceFeedbackSha256": "5fce4956c2d60bfec61d32afb4b5d35ef887e0b5a062f94ef910a59a8259ddbf",
  "optimizationCandidateRefs": [],
  "parseDisposition": "parsed",
  "feedbackRecords": [
    {
      "schemaVersion": "1.0",
      "kind": "feedback-record",
      "feedbackId": "teacher-feedback-5fce4956c2d60bfe",
      "subjectPack": "math-answer",
      "source": "teacher_input",
      "primaryErrorType": "format_error",
      "contributingErrorTypes": [],
      "confidence": 0.9,
      "severity": "low",
      "evidence": {
        "method": "teacher_text_lexicon_v1",
        "sourceFeedbackSha256": "5fce4956c2d60bfec61d32afb4b5d35ef887e0b5a062f94ef910a59a8259ddbf",
        "sourceRunSha256": "d19f8766895cdeaa13408756156edba723c6dd4b28aaaa27dbe9dc0c4a62a1b9",
        "matchedErrorTypes": [
          "format_error"
        ],
        "matchedSeverities": [
          "low"
        ]
      },
      "reproInput": {
        "sampleId": "synthetic-linear-equation",
        "iteration": 1,
        "candidateArtifactRef": "structured/math-answer/synthetic-linear-equation/candidate.generated-format-omission.md"
      },
      "reporter": "synthetic_teacher_fixture",
      "status": "parsed",
      "firstObservedIteration": 1,
      "createdAt": "2026-07-26T13:01:00.000Z"
    }
  ],
  "stopReason": "feedback_recorded_no_optimizer"
}
