{
  "schemaVersion": "2.0",
  "kind": "feedback-parse-result",
  "sampleId": "synthetic-linear-equation",
  "subjectPack": "math-answer",
  "parseMode": "teacher_text_lexicon",
  "sourceRunSha256": "ba5b6fe543624d8c40fe8ac7fa3788a2c73dfbb39bbf1bb75e04e5811140f9ec",
  "sampleIndexSha256": "0c8a6b48c6abe8e1a010a6813451fe79ebdad76f1f016668627bd7a74677b3c7",
  "samplePackageSha256": "04c8c1fdfeec27ef4bf8b712e90e8ee557f71cb51f4b4b43cecff81f667907e1",
  "candidateDescriptorSha256": "28dd5925812c136b78f81dd6f3698c4fe7c998a5ddb2517e6a555bbf5ef03081",
  "sourceFeedbackId": "synthetic-teacher-reasoning-medium",
  "sourceFeedbackSha256": "7b34f75874ebc5396f10e77419963cac669db430a4d87818ad56db5909f85439",
  "optimizationCandidateRefs": [],
  "parseDisposition": "parsed",
  "feedbackRecords": [
    {
      "schemaVersion": "1.0",
      "kind": "feedback-record",
      "feedbackId": "teacher-feedback-7b34f75874ebc539",
      "subjectPack": "math-answer",
      "source": "teacher_input",
      "primaryErrorType": "reasoning_error",
      "contributingErrorTypes": [],
      "confidence": 0.9,
      "severity": "medium",
      "evidence": {
        "method": "teacher_text_lexicon_v1",
        "sourceFeedbackSha256": "7b34f75874ebc5396f10e77419963cac669db430a4d87818ad56db5909f85439",
        "sourceRunSha256": "ba5b6fe543624d8c40fe8ac7fa3788a2c73dfbb39bbf1bb75e04e5811140f9ec",
        "matchedErrorTypes": [
          "reasoning_error"
        ],
        "matchedSeverities": [
          "medium"
        ]
      },
      "reproInput": {
        "sampleId": "synthetic-linear-equation",
        "iteration": 1,
        "candidateArtifactRef": "structured/math-answer/synthetic-linear-equation/candidate.generated-arithmetic-slip.md"
      },
      "reporter": "synthetic_teacher_fixture",
      "status": "parsed",
      "firstObservedIteration": 1,
      "createdAt": "2026-07-26T13:00:00.000Z"
    }
  ],
  "stopReason": "feedback_recorded_no_optimizer"
}
